ID,Label,Definition,Definition Source,See Also,Editor,RDF Type,Class Type,Parent IRI
curato:0000065,semantic validation,the process of checking against a set of semantic rules to ascertain information content validity (rather than its format),,,Philippe Rocca-Serra,owl:Class,subclass,validation
curato:0000066,constraint validation,the process of checking against a set of constraints,,,Philippe Rocca-Serra,owl:Class,subclass,validation
curato:0000067,compliance assessment,an assessment process which ascertain conformance to a set of specifications,,,Philippe Rocca-Serra,owl:Class,subclass,assessment
curato:0000068,data hosting,the process of storing and serving data,,,Philippe Rocca-Serra,owl:Class,subclass,Process
curato:0000069,file hosting,the process of storing and serving files,,,Philippe Rocca-Serra,owl:Class,subclass,data hosting
curato:0000070,ontology hosting,the process of storing and serving semantic artefacts,,,Philippe Rocca-Serra,owl:Class,subclass,data hosting
curato:0000071,identifier management,"the process of handling (minting, serving, deprecating, obsoleting) data item used to denotes and uniquely mark entities:",,,Philippe Rocca-Serra,owl:Class,subclass,information management
curato:0000072,identifier minting,the process of creating an identifier (e.g. DOI),,,Philippe Rocca-Serra,owl:Class,subclass,identifier management
curato:0000073,identifier resolution,the process of handling a request formed from an identifier and direct the requesting agent to the relevant content,,,Philippe Rocca-Serra,owl:Class,subclass,identifier management
curato:0000074,identifier mapping,the process of provinding a correspondance between identifiers from 2 distinct resources for the equivalent entities,,,Philippe Rocca-Serra,owl:Class,subclass,identifier management
curato:0000075,identifier tombstoning,"the process of leaving a marker in a location where a digital record has been withdrawn, in order to signify that the record had previously existed.",,,Philippe Rocca-Serra,owl:Class,subclass,identifier management
curato:0000076,data storage,the process of preserving data and information in digital form,,,Philippe Rocca-Serra,owl:Class,subclass,Process
curato:0000077,rdbms data storage,a data storage process which uses a relational database management system,,,Philippe Rocca-Serra,owl:Class,subclass,data storage
curato:0000078,document oriented data storage,a data storage process which uses a storage system indexing document directly,,,Philippe Rocca-Serra,owl:Class,subclass,data storage
curato:0000079,graph data storage,a data storge process which stored data as a graph based representation (in contrast to table based representation as in RDBMS),,,Philippe Rocca-Serra,owl:Class,subclass,data storage
curato:0000080,publication,the process of making a data object available to a public,,,Philippe Rocca-Serra,owl:Class,subclass,information management
curato:0000081,versioning,the process of handling managing the evolution and changes to a data object,,,Philippe Rocca-Serra,owl:Class,subclass,information management
curato:0000082,data assessment,an assessment process which focuses solely on data,,,Philippe Rocca-Serra,owl:Class,subclass,assessment
curato:0000083,statistical assessment,an assessment process which relies on statistical methods and exploration to carry out an evaluation against a set of metrics,,,Philippe Rocca-Serra,owl:Class,subclass,assessment
curato:0000084,domain expert assessment,an assessment process carried by a human agent whose domain knowledge is recognized,,,Philippe Rocca-Serra,owl:Class,subclass,assessment
curato:0000085,collegial/community assessment,an assessment process carried by a group of human agent whose domain knowledge is recognized,,,Philippe Rocca-Serra,owl:Class,subclass,assessment
curato:0000086,quality assessment,a process which aims to evaluate the quality of an entity,,,Philippe Rocca-Serra,owl:Class,subclass,assessment
curato:0000087,quality assurance,"a process in which the delivery of a service or the quality of a product is assessed, and compared with that required.",,,Philippe Rocca-Serra,owl:Class,subclass,Process